Pantun,Pemantun,Himpunan,Tema,Jenis,Markah
"Negeri kedah jelapang padi,
Punca rezeki suburnya tanah,
Hidup bergadah bangsa berbudi,
Elakkan berdengki kelak musnah.",Nurul Hikmah,Penggemar Pantun,PERPADUAN,PANTUN 4 KERAT,25
"Anak pemburu jarang tersasar,
Membidik rusa untuk dijamu;
Peranan guru sangatlah besar,
Mendidik bangsa tak pernah jemu.",Amirul Husni,Penggemar Pantun,Ilmu,Kepentingan Berilmu,25
"Jauh di kota pergi memburu,
Berbekal ketupat membawa jerat;
Hendaklah kita hormati guru,
Ilmu berkat dunia akhirat.",Amirul Husni,Penggemar Pantun,Ilmu,Kepentingan Berilmu,23
"Tumbuh berjajar teratai di kolam,
Dijaga pemuda memakai tongkat;
Tekun belajar siang dan malam,
Ilmu di dada bertambah berkat.",Amirul Husni,Penggemar Pantun,Ilmu,Kepentingan Berilmu,25
"Bulan purnama terangi dunia,
Di waktu malam suluh cahaya,
Janganlah leka dengan berfoya,
Carilah ilmu sampai berjaya.",Amirul Husni,Penggemar Pantun,,,20
"Bersongket baru tuan laksamana,
Megah berjalan berwajah tampan;
Ilmu diburu penuh bermakna,
Buat bekalan di masa depan.",Amirul Husni,Penggemar Pantun,Ilmu,Kepentingan Berilmu,24
"Pohon cermai di tepi paya,
Tumbuh rapat bersama delima;
Jika hidup mahu berjaya,
Dunia akhirat kejar bersama.",Amirul Husni,Penggemar Pantun,Ilmu,Kepentingan Berilmu,21
"Pohon cermai di tepi paya,
Tumbuh rapat bersama delima;
Jika hidup mahu berjaya,
Dunia akhirat kejar bersama.",Amirul Husni,Penggemar Pantun,Ilmu,Kepentingan Berilmu,21
"Hinggap lebah di daun kari,
Tepian titi berpasak lima;
Tabah menempuh onak duri;
Kejayaan pasti akan menjelma.",Amirul Husni,Penggemar Pantun,Ilmu,Kepentingan Berilmu,22
"Berjalan ke hulu berbaju biru,
Membawa jamu disapa nyonya;
Dengar selalu nasihat guru,
Kelak ilmu ada berkatnya.",Amirul Husni,Penggemar Pantun,Ilmu,Kepentingan berilmu,23
"Terbang kenari di pagi hari,
Hinggap di berangan diapit sena;
Ilmu dicari serata negeri,
Jadi pegangan hidup sempurna.",Amirul Husni,Penggemar Pantun,Ilmu,Kepentingan Berilmu,23
"Kalau ingin memintal benang,
Jangan sendiri perlu berteman;
Kalau ingin hidupnya senang,
Ilmu dicari buat pedoman.

",,Penggemar Pantun,,,23
"Timur barat selatan utara,
banyak negeri di Malaysia,
Bangsa muafakat sentiasa dipelihara,
Kenangan dipatri sepanjang usia.",Nurul Hikmah,Penggemar Pantun,PERPADUAN,PANTUN 4 KERAT,16
"Lima bersaudara pahlawan Melaka,
Berjuang untuk raja tercinta,
Rusuhan mara tidak dijangka,
Perpaduan dibentuk sejarah tercipta.",Nurul Hikmah,Penggemar Pantun,PERPADUAN,PANTUN 4 KERAT,23
"Memudik arus Sungai Tembeling,
Hinga tiba Kuala Tahan,
Bersatu terus tanpa berpaling,
Kekuatan bangsa seutuh dahan.",Nurul Hikmah,Penggemar Pantun,PERPADUAN,PANTUN 4 KERAT,22
"Di bawah bayu negeri Sabah,
Negeri mengarak awan putih,
Rakyat perlu hidup muhibah,
Bersama semarak himpunan kasih.",Nurul Hikmah,Penggemar Pantun,PERPADUAN,PANTUN 4 KERAT,21
"Pagi-pagi memetik pegaga,
Memetik pegaga bersama si dara;
Tingkat laku harus dijaga,
Nama baik dapat dipelihara.",Najihah Halim,Penggemar Pantun,Budi,Akhlak,21
"Pahitnya rasa makan hempedu,
Dibilas lidah enaknya rebung;
Semua bangsa bersatu padu,
Hidup di bawah satu bumbung.
",Sofea Erni Binti Mohd Shafari,Penggemar Pantun,Perpaduan,Semangat,25
"Sungguh gurih gorengan dusun,
oleh-oleh letak di para;
Tepak sirih belum disusun,
belum boleh mula bicara.",CG Karmin Abbas,Himpunan Pantun CG Karmin Abbas,Adab,Masakan,25
"Tepi kota ada perigi,
asah parang jangan terluka;
Kalau kita berhidung tinggi,
tentulah orang tidak suka.",CG Karmin Abbas,Penggemar Pantun,Hidung Tinggi,Nasihat,25
"Adik saya seorang doktor,
dia menolong orang sakit;
Orang berasa sangat bersyukur
walaupun mendapat sedikit",suzann,Penggemar Pantun,,,20
"Burung Balam terbang di latar,
bukit-bukau saujana mata;
Cantiknya Kolam Air Seletar,
buat terpukau pandangan kita.",CG Karmin Abbas,Himpunan Pantun CG Karmin Abbas,Keindahan,Gambaran,25
"Di tepi kota ada perigi,
kering laksana tuanya tombong;
Jikalau kita hidung tinggi,
itu bermakna kita sombong.",CG Karmin Abbas,Himpunan Pantun CG Karmin Abbas,Sombong,Pantun PEribahasa,25
"Ada kota atas kayangan,
mambang berang bersua muka;
Jikalau kita campur tangan,
meluat orang tidak suka.",CG Karmin Abbas,Himpunan Pantun CG Karmin Abbas,Marah,Teguran,25
"Tegap berdiri kukuh kekal,
teras dipagar runtuh sukar ;
Tiap hari kayuh basikal,
nafas segar ototpun kekar.",Agusnadi Talah,Penggemar Pantun,Nasihat,Olahraga,25
"Pabila kelok dibilang-bilang ,
Itulah tanda denai dijaga;
Pabila elok budi dijulang,
itulah tanda paling berharga.",CG Karmin Abbas,Himpunan Pantun CG Karmin Abbas,Pujian,Ucapan,25
"Rumah tinggi bersegi-segi,
baru saja langitnya cerlang;
Di waktu pagi kita pergi,
hampir senja baru lah pulang.",CG Karmin Abbas,Himpunan Pantun CG Karmin Abbas,Pulang,Semangat,25
"Puyuhnya bukan sebarang puyuh,
telur di raga manakah baki?
Kayuhnya bukan sebarang kayuh,
perah tenaga cari rezeki.",CG Karmin Abbas,Himpunan Pantun CG Karmin Abbas,Rezeki,Semangat,25
"Puyuh berlarian pasir berserakan,
bersegi-segi tanah pematang ;
Kayuh seharian kita lakukan;
pergi dipagi pulang dipetang.",Agusnadi Talah,Penggemar Pantun,Jenaka,Olahraga,24
"Serimbun Inggu Puan tanamkan,
meruah-ruah bagai kemumu;
Tahniah Cikgu saya ucapkan,
sungguh bertuah anak didikmu.",CG Karmin Abbas,Himpunan Pantun CG Karmin Abbas ,Pujian ,Ucapan,25
"Tanah gambut di pinggir kali,
tempat lalu orang ke hulu;
Selamat sambut Hari Diwali,
moga Vshnu selamat selalu.",CG karmin Abbas,Himpunan Pantun CG Karmin Abbas,Diwali Deepavali,Ucapan Diwali,25
"Buah bidara  buah delima,
dilipat-lipat kain belacu;
Sungguh gembira hidup bersama,
semoga cepat mendapat cucu.",CG Karmin Abbas,Himpunan Pantun CG Karmin Abbas,Perkahwinan,Ucapan Perkahwinan,25
"Hendak dijual sikain katun,
diganti tambur harga sepadan ;
Pecah bual berisikan pantun,
diselingi kombur gaya Medan.",Agusnadi Talah,Penggemar Pantun,Jenaka,Bual,24
"Sapu ijuk hendak dijual,
bersama gancu dengan nyiru ;
Konten bertajuk pecah bual,
pastilah lucu serta seru.",Agusnadi Talah,Penggemar Pantun,Hiburan,Lawak,25
"Berabad-abad tumbuhnya lebat,
berseri-seri si paku-pakis;
Pameran APAD sangatlah hebat,
tidak terperi karya pelukis.",CG Karmin Abbas,Jimpunan Pantun CG Karmin Abbas,APAD,Pujian,25
"Saya duduki peperiksaan,
tetapi saya berasa risau.
Saya mengulangkaji ujian.
Saya lupa bawa pena biru.",Jasneer Singh,Penggemar Pantun,Seorang pelajar yang pelupa,"Kelupaan, sekolah.",21
"hidangan yang enak nenek saya
sediakan untuk hari lahir
walaupun dia kurang upaya,
dia seorang yang amat mahir
",Nourlyn Sherisa Binte Mohamed Fazrine (DMNSS),Penggemar Pantun,kemahiran nenek saya,,23
"Kalau pelajar gagal sekali,
Kamu jangan berputus asa;
Selepas itu kamu kembali,
untuk menjadi lebih sasa",annur daania,Penggemar Pantun,Pelajar,,21
"Balam perkutut sama ditaman,
sama rehat setelah berkirab;
Senam lutut bersama teman,
sendi sehat temanpun akrab.",Agusnadi Talah,Penggemar Pantun,Kesehatan,Olahraga,25
"Pagi dingin udara terhisap,
cekal layuh bawa istirahat;
Termakan angin tanpa berasap,
baisikal dikayuh raga sehat.
",Agusnadi Talah,Penggemar Pantun,Kesehatan,Olahraga,25
"Untuk tetamu berendang palas ;
Tungkunya batu kayunya arah ,
Janganlah takut untuk membalas ;
Ghairah di mukanya , hati cerah




",Insyirah Banu Binte Mohamed Ali ( DMSS ),Penggemar Pantun,Membalas kegembiraan,,23
"Kita akan pergi ke sekolah,
di tepi kolong blok kawan saya.
Saya akan berasa gembira,
kerana sekolah istimewa.",Jasneer,Penggemar Pantun,Sekolah saya,Sekolah,20
"Saya tidak tahu bagaimana,
saya akan buat kerja ini.
Saya akan tanya kawan saya,
menolong buat kerja di sini",Jasneer,Penggemar Pantun,Pertolongan kawan,Kawan,21
"Kalau bujur mulut kuali,
jangan lepa imbang di palang;
Orang mujur kalau peduli,
tidak lupa orang yang malang.",CG Karmin Abbas ,Himpunan Pantun CG Karmin ,Peduli,Nasihat,25
"Anaklah itik berenang-renang,
sampai ke tengah dipatuk ruan;
Anak nan cantik terkenang-kenang,
bolehkah angah mengenal puan.",Pensil Kajoe,FPL,Terkenang,Usik-mengusik,25
"Kerupuk sanjai tanda mata,
pasti buatan kita bersama;
Buah binjai yang punya kota,
buah rambutan punya nama.",Agusnadi Talah,Penggemar Pantun,Kota,Sejarah,24
"Baju renda gambar diorama,
gambar diorama bunga melati;
Apa beda dengan yang lama,
mari bersama kita nanti.",Agusnadi Talah,Penggemar Pantun,,,24
"Anak dara berbaju biru,
baju renda gambar diorama;
Buat acara secara baru,
apa berbeda dengan yang lama.",Agusnadi Talah,Penggemar Pantun,Acara,Pertemuan,25
"Tolong jolokkan sebiji mangga
pohon di batas banyaknya tentu;
Hidup bagaikan naiki tangga,
Naik ke atas satu persatu",Dian Qistina Binte Adi Irman (DMS),Penggemar Pantun,Usaha,Motivasi ,25
"Marilah pergi ke kedai bunga ,
Bunga dibeli cantik sekali;
Alam sekitar perlu dijaga,
Agar hidup selalu harmoni.",Jasneer Singh,Penggemar Pantun,Alam sekitar,Alam sekitar,19
"Bunga semua cantik semacam
Ibu saya bau begitu
Tiada pula orang semacam
Sayang bunga seperti ibu",Ilham Hanafi (Sekolah Menengah Dunman),Penggemar Pantun,Alam sekitar,Sayangan ibu,19
"anak ikan berenang-renang,
beribu-ribu di tengah kolam;
anak nan comel berlayang-layang,
ketemu ibu gegas bersalam",Falisha(dunman secondary school),Penggemar Pantun,ikan,kolam ikan,21
"Aku ke tanam yang berdekatan aku
Aku ke arah bunga matahari yang terang
Aku melihat lebar yang berada di bunga
Aku juga mencium bunga yang amat terang",Nasyrah Binte Johan (dmns) ,Penggemar Pantun,Alam sekitar ,Alam sekitar ,15
"Kita pergi ke kedai bunga,
bunga dibeli cantik sekali.
Alam sekitar harus dijaga,
agar hidup sentiasa harmoni",Jasneer Singh,Penggemar Pantun,Alam sekitar,Alam sekitar,17
"Bunga semua cantik semacam
Ibu saya bau begitu
Tiada pula orang semacam
Sayang bunga seperti ibu
 ",Ilham Hanafi,Penggemar Pantun,Alam sekitar,Sayangan ibu,19
"Anak ikan berenang-renang,
sampai ke tengah dipatuk kolam;
Anak nan comel berlayang-layang,
ketemu ibu gegas bersalam",Falisha,Penggemar Pantun,ikan,kolam ikan,20
"Jangan menjadi anak malas,
Engkau mesti menolong orang;
Malasan kamu akan balas,
Kalau begitu ibu garang",Insyirah Banu Binte Mohamed Ali ( DMS ),Penggemar Pantun,Kemalasan,,23
"Jangan tunggu lama-lama, 
Kalau makanan depan mata,
Nanti dapat satu karma,
Tak dapat anak dara.",,Penggemar Pantun,,,15
"Ayam kampung goreng halia,
Bukan makanan orang hartawan,
Jika hidup aman bahagia,
Jangan lupa langit berawan.",,Penggemar Pantun,,,20
"Buah Pedada sudahpun basah,
dimakan kuda dengan kulitnya;
Hidup ada senang dan susah,
air ada pasang surutnya
",Azfar,Penggemar Pantun,Motivasi,Motivasi,25
"Kalau pelajar gagal sekali,
Eloklah jangan berputus asa;
Maka itu belajar kembali,
supaya menjadi lebih sasa",annur,Penggemar Pantun,Pelajar,Imbuan,23
"Jikalau kota atas kayangan,
berpantang larang di makam suci;
Jikalau kita campur tangan,
nanti orang menjadi benci.",CG Karmin Abbas,Penggemar Pantun,Pantang larang,Nasihat,25
"Pulau Pandan jauh ke tengah, 
Gunung Daik bercabang tiga;
Hancur badan dikandung tanah,
budi baik dikenang juga",,Penggemar Pantun,,,23
"Jangan menjadi anak malas,
engkau mesti menolong orang;
Malasan kamu akan balas,
Kalau begitu ibu garang",Insyirah,Penggemar Pantun,Kemalasan,,23
"Ada semut kerana gula
Semut itu amat lega
Kita mestilah banyak doa
Supaya kita masuk syurga
",,Penggemar Pantun,,,16
"Kayuh basikal pergi ke taman,
Kawan lama inginku bertemu,
Balik ke rumah cucilah tangan,
Agar bersih dan sihat selalu",Alisha Rai,Penggemar Pantun,basikal,,19
"Tolong jolokkan sebuah kelapa
jadi rezeki mari dicatu;
hidup bagaikan menaiki tangga,
kita naiki satu persatu



",Dian,Penggemar Pantun,,,21
"sebuah kuasa saya mencari,
apakah yang berada di luar,
dengan wasiat saya berlari,
bersama harapan saya mendapat",muizz,Penggemar Pantun,kuasa,pantun,19
"Kita tidak ada masa lama,
kerana ujian akan akhir.
Saya tidak berasa gembira, 
kerana saya rasa khuatir.
",Jasneer Singh,Penggemar Pantun,Ujian ,Ujian,20
"dua tiga kucing berlari,
mana nak sama ssi kucing belang,
jika tidak menjaga bumi,
nanti datang bencana alam
",shariq,Penggemar Pantun,sekitar alam,empat kerat,18
"Burung undan riang berbunyi,
terbang selisih cari makan;
Kata hikmah dan ilmu tak sunyi,
terima kasih kami ucapkan.",,Penggemar Pantun,,,25
"Burung serindit terbang melayang,
Terhenti hinggap di ranting mati,
Bukan ringgit dipandang orang,
Tetapi memandang bahasa dan budi",,Penggemar Pantun,,,18
"Mari berembuk pikas wisata,
rentak dan lagu menjadi satu;
Enaknya terubuk tidak terkata,
banyak menunggu di Labuan Batu.
",,Penggemar Pantun,,,25
"Kalau kelompak tampak di mata
enak dirasa gulai meranti ;
banyaknya tapak tempat wisata,
eremerasa tetap di hati. ",,Penggemar Pantun,,,25
"anaklah itik berenang-renang,
sampai ke tengah dipatuk ruan;
anak nan cantik terkenang-kenang,
bolehkah angah mengenal puan.",,Penggemar Pantun,,,25
"Mari berembuk pikat wisata,
rentak dan lagu menjadi satu;
Enaknya terubuk tidak terkata,
banyak menunggu di Labuan Batu.",,Penggemar Pantun,,,25
"Kalau kelopak tampak di mata
Enak dirasa gulai meranti;
Bayaknya tapak tempat wisata,
Eremerasa tetap di hati.",,Penggemar Pantun,,,25
"Mari berembuk pikat wisata,
rentak dan lagu menjadi satu;
Enaknya terubuk tidak terkata,
banyak menunggu di Labuan Batu",,Penggemar Pantun,,,25
"Mari berembuk pikat wisata,
rentak dan lagu menjadi satu 
Enaknya terubuk tidak terkata,
banyak menunggu di Labuan Batu",,Penggemar Pantun,,,25
"Mari berembuk pikat wisata,
rentak dan lagu menjadi satu;
Enaknya terubuk tidak terkata,
banyak menunggu di Labuan Batu.",Yerni Arief,Klinik Pantun Nusantara,Kuliner Terubuk,Wisata,25
"Petiklah satu si buah cermai,
mari dipetik buah yang hujung;
Labuan batu indah dan permai,
marilah adik datang berkunjung.",Tok Dalang,,Imbauan,Wisata,25
"Minyak angin seribu satu,
minyak wijen kuali besi;
Rasanya ingin ke Labuan batu,
kutengok keponjen tak ada isi.",Tok Dalang,Jalinan Sastra RRI Pontianak,Kepingin,Jenaka,25
"Kalau kelopak tampak di mata
enak dirasa gulai meranti;
banyaknya tapak tempat wisata,
eremerasa tetap di hati.
",Rosdalifah BANTAENG,FPL,Eremerasa,Wisata,25
"Si buah dukuh Si buah selasih,
selasih serasi duduknya santun;
Kitapun sungguh sangatlah bersedih,
asyik berpuisi lupa berpantun.

",Tatang Pohan,FPL,Lupa berpantun,Ingatan,22
"Tertusuk duri di kebun bambu,
coba teriak sambil merintih;
Saya Arie dari Labuanbatu,
mengucap banyak terima kasih.",Arie Siregar,FPL,Terima kasih,Ucapan,22
"Labuanbatu di pantai timur,
ramai ahli sanak saudara;
Berpantun tentu menjadi makmur,
bangkit kembali ikatan mesra.",CG Karmin Abbas,Himpunan Pantun CG Karmin,Persaudaraan,Masyarakat,25
"Siput berongan di paya bakau,
angin bersiru lautpun pasang;
Angan-angan akan terjangkau,
deru-deru jadi perangsang.",CG Karmin Abbas,Himpunan Pantun CG Karmin ,Azam,Motivasi,25
"Ungunya daun indahnya nian,
tenggek berjemur seekor pipit;
Alam laun dijaga kian,
Agar makmur datang mengapit.",Penggemar Pantun,Penggemar Pantun,alam,Motivasi,25
"Gesek rebab irama Lingga,
naik turun lagu berzaman;
Warisan beradab kalau dijaga,
berkurun-kurun jadi pedoman.",CG Karmin Abbas,Himpunan Pantun CG Karmin,Warisan,Inspirasi,25
"Rumah sebandung bidai berjalur,
putih menjelma hitam bak arang;
Hasrat dikandung jasa dihulur,
selama-lama dikenang orang.",CG Karmin Abbas,CG Karmin Abbas,Jasa,Motivasi,25
"Banyak orang pergi berdagang,
membawa barang dari desa;
Hamba sekadar singgah bertandang,
rai acara pusaka bangsa.",Prof. Awang Sariyan,Pusaka Pantun Prof. Awang Sariyan,Bertandang,Ucapan,25
"Berbingkai cermin kanan dan kiri,
lentik jerami berlembar-lembar;
Nampak pelamin berseri-seri,
cantik suami  isteri bergambar. ",,,,,24
"Pokok senduduk penuh di rawa,
tempat kedidi membuat sarang;
Meru penduduk ramainya Jawa,
makanan tradisi banyak dihidang.",Pak Lang,Pantun Pak Lang,Masyarakat Jawa,Budaya,25
"Pergi ke hutan mencari kera,
kaki tersandung perdu belinjau; 
Nyaman berjalan di Singapura, 
teduh dilindung pohon menghijau.
",Rohani Din,Pantun Rohani Din,Suasa Di Singapura,Keindahan Di Singapura,25
"Bulan mengambang di balik awan,
pungguk merindu diam menyepi;
Kenang abang jauh di rantauan,
berteman rindu di dalam mimpi.",Khalid Zainul,Pantun Khalid Zainul,Rindu,Perhubungan,25
"Menghela busur beranak panah,
di tarik tolak selarat-larat;
Amal beransur satu amanah,
untung kelak dunia akhirat.",CG Karmin Abbas,Himpunan Pantun CG Karmin,amanah,Motivasi,25
"Si Bunga manggar di kanan kiri,
adat di bandar di kampung sama;
Tidak teranggar tidak terperi,
tidakkan pudar selama-lama.",CG karmin Abbas,Himpunan Pantun CG Karmin,Persandingan,Warisan,25
"Kereta Api Tanah Melayu,
stesyennya dekat di Tanjong Pagar;
Berjampi-jampi Tuan Merayu,
janji terikat menjadi longgar.",CG Karmin Abbas,Himpunan Pantun CG Karmin,Mungkir Janji,Sindiran,25
"Mudik si Teguh sehingga Siantar,
membawa penaram berbagai rasa;
Nyamanlah sungguh Rumah Pelantar,
hati tenteram damai sentosa.",Diana Dee,Diana Dee,Tenang,Kenangan,25
"Ladang tembakau Bukit Seletar,
bergaris-baris batas terisi;
cita terjangkau belajar gitar,
mula menulis lagu puisi.",CG Karmin Abbas,Himpunan Pantun CG Karmin ,Kenangan,Inspirasi,25
"Wangian direnjis di pelaminan,
Pengantinnya pula tersenyum malu;
Semoga majlis Tuhan berkenan
lebih Utama doa Dan restu ",Yahya Hamid,Koleksi Persadaku,Doa,Bersanding,23
"Ada nuri di tepi jeti,
sedang kopek buah ketapang;
Tak terperi baiknya hati,
tidak lokek berdada lapang.",CG Karmin Abbas,Himpunan Pantun CG Karmin,Baik Hati,Motivasi,25
"Apa ada di Telok Kurau? 
lubuk tamban juga gelama;
Siapa ada di dalam surau? 
atok bersarban solat bersama. ",CG Karmin Abbas ,Himpunan Pantun CG Karmin Abbas ,Solat,"Bertanya, Ingin tahu",25
"Sengit marah gemeretuk gigi,
lutut berderap tiada henti;
Langit memerah diwaktu pagi, 
pelaut harap berhati-hati.",Agusnadi Talah,Penggemar Pantun,Alam,Nasihat,25
"Darah belangkas berwarna biru,
dimasak lemak bercili padi;
Elakkan lekas terburu-buru,
hasilnya remak pasti menjadi.",CG Karmin Abbas,Himpunan Pantun CG Karmin,Sabar,Nasihat,25
"Menampin-nampin orang bertampin,
beralih-alih nusa ke nusa;
Pilih pemimpin antara pemimpin,
tersalah memilih bangsa binasa.",CG Karmin Abbas,Himpunan Pantun CG Karmin,Pemimpin,Nasihat,25
"Manis lesung pipit di pipi, 
comel loteh sangat ceria;
Berjumpa langsung hilanglah sepi,
kuat celoteh beriya-iya.",CG Karmin Abbas,Penggemar Pantun,Ceria,Perasaan,23
"Nampaklah segeh susunan pisin, 
urap kelapa digaul dara;
Tumiskan taugeh berikan asin,
apakah depa sama selera?",CG Karmin Abbas ,Himpunan Pantun CG Karmin ,Selera,Gurau,25
"Menglegek-glegek budaknya gagap, 
garu kepala lepas bersapa;
Jikalau tenggek itu hinggap,
tengger pula maknanya apa? ",CG Karmin Abbas ,Himpunan Pantun CG Karmin ,Bahasa,"Teka-teki, humor, jenaka ",25
"Bukan sumpit sebarang sumpit,
sumpit dikarang di tanah karo;
Bukan Covid sebarang Covid,
Covid sekarang semakin ngeri, Bro!",Dr. Umar Zein,Pantun Covid,Covid,Jenaka,22
"Dari Jelapang ke Bukit Timah,
singgah solat di Masjid Ba'alwi;
Sikap garangmu menjadi lemah,
dek lunak kata dan baik budi.",Maarof Salleh,Koleksi Peribadi,Budi,Nasihat,23
"Ada tiga ekor memerang,
ramai orang datang melihat;
Jiwa lega selalu girang,
tekanan kurang hidup sihat.",CG Karmin Abbas,Himpunan Pantun CG Karmin,Sihat,Motivasi,25
"Melata-lata bagai elegi,
runcingan kuku mencekau-cekau;
Daya cipta jikalau tinggi,
diam kaku terkena pukau.",CG Karmin Abbas,Himpunan Pantun CG Karmin,Kreativiti,Inspirasi,25
"Rumah ini bertangga-tangga,
baru tadi sampai serambi;
Hari ini tercapai juga,
hasrat jadi model HDB.",CG Karmin Abbas,Himpunan Pantun CG Karmin,Angan-angan,Gurau,25
"Geroda kuat sanjungan manusia, 
meremas-remas di atas keraton;
Syabas buat rakyat Indonesia
menang emas acara badminton!",CG Karmin Abbas,Himpunan Pantun CG Karmin,Olimpik,Motivasi,25
"Bukalah tingkap tariklah bidai, 
cuaca hangat ke petang hari;
Duduk bercakap dengan yang pandai;
dapat semangat yakinkan diri,",CG Karmin Abbas ,Himpunan Pantun CG Karmin ,Semangat,Motivasi,25
"Wadah rembulan didahan randu,
semarkah bahu berlerang bayang;
Sudah berbulan menahan rindu,
apakah tahu orang disayang ?",,Penggemar Pantun,,,25
"Ada rembulan didahan randu,
berbayang bayang sebatas bahu ;
Sudah berbulan menahan rindu,
orang disayang apakah tahu.",Agusnadi Talah,Penggemar Pantun,Asmara,Perasaan,25
"Bertanam coklat mari rapatkan,
belah akasia sama pegaga;
Selamat milad saya ucapkan,
berkah usia sama keluarga.",Agusnadi Talah,Penggemar Pantun,Ulang tahun,Doa,22
"Kaperas Sige ku Gerdang Gerdungken
Paku La Santan Tama Tare Pinggan
Muas Melihe Banci Kutahanken
Aku La Atan Ija  Aku Ringan
",Kumalo Tarigan,Karo,Cinta,Anak Muda,24
"matawari sipukul siwah
deleng Sinabung mbue kertahna
Sadawari kam lakuidah
timbang setahun akap dekahna
",Jenda Bangun,Karo,Cinta,Romantisme,22
"Berastagi ku Bandarbaru 
Sarinembah sinuan buluh
Ersentabi kami man bandu
Riket nembah jari sepuluh
",Pulumun Ginting,Karo,Hormat,Adat,24
"pulau pandan jauh ke tengah
gunung daik bercabang tiga
hancur badan dikandung tanah
budi baik dikenang juga",Hamba Alah,Penggemar Pantun,Budi,Nasihat,23
"Setelah tuang kulit kuaci,
kupaslah baki perlahan-lahan;
Ada uang di dalam laci,
tapi rezeki di tangan Tuhan.",CG Karmin Abbas ,Himpunan Pantun CG Karmin ,Rezeki,Pedoman,25
"Anyam ketupat satu persatu,
tiada tara meruah-ruah;
Sudah mendapat izin dan restu,
atur acara agar meriah.",CG Karmin Abbas ,Himpunan Pantun CG Karmin ,Rancang,Pedoman,25
"Apa itu ketupat palas?
intinya tentu beras pulut;
Benar itu di dalam jelas,
bohong itu di dalam kalut.",CG Karmin Abbas,Himpunan pantun CG Karmin,Benar dan bohong,Ilmu pengetahuan,25
"Pinggir kota Teluk Baiduri, 
Singgah situ buka puasa;                         
Jikalau kita merendah diri,
Allah tentu sayang sentiasa. ",Na'aim Pani,Peribadi,Rendah diri,Nasihat,25
"Bawa anak pergi berlayar,
Berlayar bersama burung merpati,
Hutang emas boleh dibayar,
Hutang budi dibawa mati.",Rafiq Danish B. Rizal,Penggemar Pantun,Budi,Pantun Nasihat,22
"Jalan ke kota jauh terasa,
Jatuh  tersandar terpijak duri:
Hindari kata  membawa dosa,
Kelak terhindar kawan sendiri.",ROSIAH BINTI OTHMAN,Penggemar Pantun,Nasihat,4 kerat,25
"Jikalau jongkong hanyut ke selat 
Janganlah angin disangka kusut
Jikalau bengkung tidak mengikat 
Janganlah kain disangka kusut ",Rendra Setyadiharja,Penggemar Pantun,Nasihat,Pantun,24
"Apalah guna menanam perdu 
Sayang daunnya dibuat majun 
Apalah guna meminum madu 
Kalau akhirnya menegak racun ",Rendra Setyadiharja,Penggemar Pantun,Cinta,Pantun empat kerat,25
"Yang hidup pastilah mati
Tiada yang kekal buat selamanya
Jangan kamu bersusah hati
Mari kita sujud pada-Nya
",NUR FARAH SYARHANA BINTI JASMIN,Penggemar Pantun,Pengajaran,Pengajaran,18
"Di situ kapuk di sini duwet,
buat acuan ungu warnanya;
Yang satu lapuk yang satu awet,
alahai Tuan apa niatnya?",CG Karmin Abbas,,Duga akal,Teka-teki,25
"Batasnya lembut di bendang padi,
bersela-sela tidak terkira;
Tuan menyambut Hari Jadi, 
kami pula tumpang gembira.",CG Karmin Abbas ,Himpunan Pantun CG Karmin ,Hari Jadi,Ucapan ,25
"Rakit menepi kuat berdendang,
orang senang melihat bertepuk;
Kulit sapi dibuat gendang,
orang Minang buat kerupuk.
",Dr. Umar Zein,Klinik Pantun Nuantara,Pantun Kelok,Kuliner,25
"Ubi  dibakar ditakar-takar,
jadi habuan agih-agihkan;
Bezanya kekar berbanding mekar,
Alahai Tuan tolong jelaskan.",CG Karmin Abbas,Himpunan Pantun CG Karmin,Perbandingan,Pertanyaan,25
"Rumpunan pokok di tanah rawa,
ulat belatung dipatuk nuri;
Kalau merokok tembakau jawa,
hisap sepuntung pening sehari.",CG Karmin Abbas,Himpunan Pantun CG Karmin ,Pening,Gurauan,25
"Di mana landak di situ duri, 
mari ramu indah karangannya;
Di mana hendak jumpa jauhari, 
meriah ilmu bijak sidangnya.",CG Karmin Abbas,Himpunan Pantun CG Karmin,Ilmu,Motivasi,25
"Bocor atap baiki atap,
bukan ember ditambah-tambah,
Covid rentap kitapun rentap,
sekat sumber bercambah-cambah.",CG Karmin Abbas,Himpunan Pantun CG Karmin,Covid,Panduan,25
"Berkerpuk-kerpuk jatuh terhempas,
jadi aduan orang ke pekan;
Bergaul kapuk bersama kapas,
alahai tuan cuba bezakan.",CG Karmin Abbas,Himpunan Pantun CG Karmin Abbas,Perbezaan,Teka-Teki,25
"Di fajar sadik berkokok lunak,
panjang alunan bunyi kokokan;
Beza yang didik dengan yang ternak,
alahai Tuan mohon asingkan.",CG Karmin Abbas,,Pengetahuan,Kuiz,25
"Elok tadi kita mengalah,

Tiada daya jadi resah,

Memilih jadi penganggur salah

Menjadi kaya sangatlah susah",Juliano A Mansiz,"Program Balai Pantun & Klinik Pantun, Mac 2021",Perasaan,Bingung,25
"Ada hasil entah kemana

Ada proses dibalik tangga

Belum berhasil pasti dihina

Sudah sukses omongan tetangga",Juliano A Mansiz,"Program Balai Pantun & Klinik Pantun, Mac 2021",Pernyataan,Pernyataan,25
"Tumbuh padi tiada mudah,

Rumput mati tiada kira,

Hari tadi biarlah sudah.

Esok pasti lebih gembira.",Juliano A Mansiz,"Program Balai Pantun & Klinik Pantun, Mac 2021",Nasehat,Nasehat,25
"Rumput basah tiada rana

Mawar kasih merah merona

Sungguh gelisah hati merana

Melihat kasih tak tahu kemana",Juliano A Mansiz,"Program Balai Pantun & Klinik Pantun, Mac 2021",Percintaan,Galau,24
"Daun dadap di atas dulang,
anak ketam mati dituba;
Dalam kitab ada dibilang,
benda haram jangan dicuba.

",Samsul Bahri,"Program Balai Pantun & Klinik Pantun, Mac 2021",Meningalkan yang haram,Pantun Naehat,23
"Ramai amat mencari kerang,
pinggir kota Telok Baiduri;
Rasa hormat tidak berkurang,
jika kita merendah diri.",CG Karmin Abbas,Himpunan Panntun CG Karmin,Hormat,Nasihat,25
