Pantun,Pemantun,Himpunan,Tema,Jenis,Markah
"Tukang permata menjual sudah,
Intan manikam dibeli kanda;
Barisan kata tersusun indah,
Pemanis kalam, pengasah minda.
",Farah Nur Zakiah Roslee,Himpunan Pantun Warna 94.2,Pantun,Empat kerat,24
"Lemak manis senyuman terlena
Anak siapa bersopan santun
Majlis ceria anjuran Warna
Semarakkan budaya berpesta pantun",Abdul Malek,Himpunan Pantun Warna 94.2,Mesra,Pantun Mesra,22
"Si Anak monyet mencuri bugis
Matanya pedih kena jelatang
Awak tertawa saya menangis
Kekasih pergi dibawa orang",,Himpunan Pantun Warna 94.2,,,19
"Mentari rembang di laut selatan,
Berlayar kelasi tuju ke selat,
Belia tunjang kesepaduan watan,
Penerus legasi Malaysia berdaulat.",MUHAMMAD RUSYAIDI BIN RAZHI ,Himpunan Pantun Warna 94.2,Belia Malaysia ,Patriotik ,24
"Dara Sunda tuju ke pekan,
Singgah sebentar bertemu aduka,
Semangat rang muda ayuh siramkan,
Agar mekar kelopak merdeka.",MUHAMMAD RUSYAIDI BIN RAZHI ,Himpunan Pantun Warna 94.2,Kemerdekaan ,Patriotik ,22
"Mendung langit berdentum guntur,
Mengguyur gerimis membasah melati,
Jiwa madani tidakkan luntur,
Tersemat rapi elok di hati.

 ",MUHAMMAD RUSYAIDI BIN RAZHI ,Himpunan Pantun Warna 94.2,Malaysia Jiwa Madani ,Patriotik,22
"Di bawah bulan purnama bersinar,
Rindu di hati takkan pernah pudar.
Bintang-bintang menghiasi malam ini,
Cinta kita abadi, takkan pernah kini.",syahir,Himpunan Pantun Warna 94.2,Cinta,Pantun cinta,14
"kopi dihirup begitu lama,
semut berderet naik ke meja; 
mahligai indah dibina bersama,
bersangka baik, maafkan saja


",Asmidah Mohd Jailani,Himpunan Pantun Warna 94.2,maafkanlah,nasihat,22
"Burung berkicauan di terbit matahari,
Angin bertiup sepoi-sepoi bahasa,
Biar sekarang kita bekerja seperti kuli,
Supaya keluarga mendapat suapan sempurna",syahir,Himpunan Pantun Warna 94.2,Kerja keras,Pantun nasihat,12
"Pisau yang tumpul hendaklah diasah
Jika tidak, mana mungkin ia memotong
Jika pemuda Melayu tidak diendah
lalu bagaimana mereka hendak ditolong?",syahir,Himpunan Pantun Warna 94.2,remaja melayu,pantun nasihat,14
"Empuknya  bantal lalu terlena,
kopi dingin di atas para;
nak kata handal tidaklah mana,
hanya ingin menyemarakkan acara.


",Asmidah Mohd Jailani,Himpunan Pantun Warna 94.2,suka- suka,bebas,22
"

Sate dimakan bersama ketupat,
daging terselit di celah gigi;
aku tak berteman, tiada sahabat,
hidupku perit, bersendiri lagi.

",Asmidah Mohd Jailani,Himpunan Pantun Warna 94.2,suka-suka,bebas,19
"Dedap merah mekar melayah
Batang perdu tetaplah kaku
Diharap usah terhindar payah
Merancang perlu ditelah liku",Alang Tengah Biru Kundang,Himpunan Pantun Warna 94.2,Pantun Memujuk Diri 3,Nasihat,23
"Perahu lama dayung menongkah
Penat sekali menggagah muara
Baru bermula tersadung langkah
Dapat berdiri teruslah mara",Alang Tengah Biru Kundang,Himpunan Pantun Warna 94.2,Pantun Memujuk Diri 2,Nasihat,22
"Walau menjoran hampa sepetang
Sebeban kerapu puas sepagi
Kalau gusarkan perkara mendatang
Syukurkan dulu bernafas lagi

",Alang Tengah Biru Kundang,Himpunan Pantun Warna 94.2,Pantun Memujuk Diri,Nasihat,21
"Benih disemai tumbuhnya padi,
Hasilnya barang harta pusaka.
Hidup beramai biarlah berbudi,
Agar orang keliling pasti suka.",Hadijah A Samah,Himpunan Pantun Warna 94.2,Budi bahasa,Pantun nasihat,25
"RIMBUN BERANGAN MELINDUNG DUKU
DI TANAH RATA LEBAT BERBUAH
DI BAWAH NAUNGAN DULI TUAN KU
RUNDUK JELATA MENUMPANG TUAH",AHMAD HAFIZD HITAM,Himpunan Pantun Warna 94.2,MALAYSIA TANAH BERTUAH,EMPAT KERAT,24
"PUTIK BUKAN SEBARANG PUTIK
PUTIK CEMPAKA HARUM BAUNYA
BATIK BUKAN SEBARANG BATIK
BATIK PUSAKA CERMINAN BUDAYA",AHMAD HAFIZD HITAM,Himpunan Pantun Warna 94.2,BATIK TRADISI,EMPAT KERAT,21
"CANTIK BERSERI UKIR BERSENI
CORAK SELASIH BERBUNGA MAYANG
KUKUH BERDIRI KELUARGA MADANI
TIANG NYA KASIH BUMBUNGNYA SAYANG
",AHMAD HAFIZD HITAM,Himpunan Pantun Warna 94.2,MALAYSIA MADANI,EMPAT KERAT,24
"Studio bukan sembarang studio,
sarana diguna artis terbilang;
Radio bukan sembarang radio,
stesenlah Warna bukanlah kepalang.",CG Karmin Abbas,Himpunan Pantun Warna 94.2,Radio Warna,Pujian,25
"Si anak rusa, anak buaya
Jatuh terduduk kera di laman
Cintakan bahasa, sayangi budaya
Tidak lapuk ditelan zaman",Zulfadhli (Jujul),Himpunan Pantun Warna 94.2,bebas,,23
"Datang berkunjung duduk di anjung
Di atas kayu gugurnya dahlia
Bahasa disanjung, budaya dijunjung
Tidaklah melayu hilang di dunia",Zulfadhli (Jujul),Himpunan Pantun Warna 94.2,Bebas,,24
"Anak Pak Pandir bermain gendang
Menari si dara bersopan santun
Saya hadir masuk gelanggang
Bersuka ria mengarang pantun",Zulfadhli (Jujul),Himpunan Pantun Warna 94.2,bebas,,20
"Panglima bermula dengan pantun,
Mengadap raja diatas tahta.
Bangsa kita bersopan santun,
Bukan budaya suka bersengketa.",Hadijah,Himpunan Pantun Warna 94.2,Budaya bangsa,,22
"CINCIN SUASA DATUK PENGGAWA
ILHAM JAUHARI DARI LAH LINGGI
SUBUR BAHASA DIRELUNG JIWA
BANGSA BESTARI BERILMU TINGGI
",AHMAD HAFIZD HITAM,Himpunan Pantun Warna 94.2,BANGSA BERILMU,EMPAT KERAT,25
"ANAK TERUNA TURUN MEMBAJAK
BERBEKAL AZIMAT WARISAN KERABAT
WALAU DIMANA KAKI MENGINJAK
BAHASA KERAMAT DI ANGKAT MARTABAT
",AHMAD HAFIZD HITAM,Himpunan Pantun Warna 94.2,BAHASA JIWA BANGSA,EMPAT KERAT,23
"GAGAH PERKASA TERUNA DESA
SAMA SRIKANDI MEMBANTING PADI
INDAH BAHASA CERMINAN BANGSA
HALUSNYA BUDI TUNJANG PERIBADI
",AHMAD HAFIZD HITAM,Himpunan Pantun Warna 94.2,BUDI BAHASA,EMPAT KERAT,24
"Kalaulah tidak kerana unggas,
Tidaklah rosak padi di sawah;
Kalau tidak kerana bertugas,
Tidaklah kita akan berpisah.",Zahairin Abd Rahman,Kelab Orang Lama,Orang Lama,Ucapan,23
"Berbahasa itu adalah berbudi
Pekerti mulia dibawa mati
Segala urusan lancar menjadi
Perkara dilakukan seikhlas hati",Abdul Malek,Himpunan Pantun Warna 94.2,Nasihat,Santai,21
"Makanan di hantar si Ramu,
Sambil menonton drama perang,
Jaga adab serta akhlakmu, 
Jangan sampai mencela orang.",Rita,Himpunan Pantun Warna 94.2,,Nasihat,23
"Sebelum kita mudik ke hulu,
Singgah sebentar di pekan,
Jangan asyik komen melulu,
Nanti menyesal di kemudian.",Rita,Himpunan Pantun Warna 94.2,Media Sosial,Teguran,16
"Masuk gelanggang si anak dara,
Langkah tersusun bersopan santun,
Awal bismillah pembuka bicara,
Kata disusun terukirlah pantun. ",Firoze Ismail,Himpunan Pantun Warna 94.2,Cintai bahasa cintai pantun,Pantun empat kerat,24
"Kalau kita jelajah angkasa,
Ayuh kita teroka berduyun,
Kalau kita cintai bahasa,
Ayuh kita belajar berpantun. ",Firoze Ismail,Himpunan Pantun Warna 94.2,Cintai Bahasa cintai pantun,Pantun empat kerat,22
"Mari kita pergi ke ladang,
Bicara kita bersopan santun,
Mari kita masuk gelanggang,
Acara kita sopan berpantun. 

",Firoze Ismail,Himpunan Pantun Warna 94.2,Cintai Bahasa cintai pantun,Pantun Empat kerat,21
"Keris Melaka berseni rekaan,
    Hulu berduri milik Andeta;
Anak merdeka jadi igauan,
    Mengelak diri tanpa sengketa.
",Huzaifi M.A,Himpunan Pantun Warna 94.2,,,24
"Dokoh suasa dipakai Tok Kadi,
   Buatan Melaka berseni rekaan;
Kemilau nusa tersemat abadi,
    Anak merdeka tanda perpaduan.",Huzaifi M.A,Himpunan Pantun Warna 94.2,PATRIOTIK,PANTUN ,21
"Dermaga pusaka binaan megah,
    Bersalur gangsa tetap berguna;
Leluhur merdeka diasak gagah,
     Warisan nusa teguh terbina.",Huzaifi M.A,Himpunan Pantun Warna 94.2,PATRIOTIK,Pantun,23
"Kalungan melati di taman selasih
Kalam tersurat di hujung laman
Kalungan budi junjungan kasih
Digenggam erat sepanjang zaman",ROSIHA ABDUL RAZAK ,Himpunan Pantun Warna 94.2,terima kasih,pantun empat kerat ,23
"Hendak sagu ruyunglah sagu
Di tengah bendang perah keringat 
Hendak  lagu diberi lagu 
Dalam bendendang membina semangat  ",ROSIHA ABDUL RAZAK ,Himpunan Pantun Warna 94.2,lagu patriotik,pantun empat kerat ,23
"Bersilat lidah berkias pantun
Bertari erat laksamana pengkarang
Beradat indah berhias santun
Seni tersurat ke mana menghilang",ROSIHA ABDUL RAZAK ,Himpunan Pantun Warna 94.2,Seni,pantun empat kerat ,21
"Buah padi di makan jelatik,
Sawah bendang di desa Gangsa,
Sungguhpun budi hanya setitik,
Akan kukenang sepanjang masa. ",Mohd Maizon bin Waham ,Himpunan Pantun Warna 94.2,Budi ,,23
"Daun dedalu luruh di tangga,
Luruh bertimpa hingga ke anjung,
Kasih ibu bawa ke syurga,
Kasih bapa tiada penghujung. ",Mohd Maizon bin Waham ,Himpunan Pantun Warna 94.2,Kasih Sayang,,23
"Lelah rasa memburu rusa,
Tampak mengkula berbuah lebat, 
Lirik dosa kanan pun dosa, 
Carilah pahala sujud bertaubat. 
",Mohd Maizon bin Waham ,Himpunan Pantun Warna 94.2,Agama,,23
"Arang di kendi hasil usaha
Semasa di titi disusun bertangga
Orang berbudi kita berbahasa
Sama mengerti sama berbangga
",Isiah Majid,Himpunan Pantun Warna 94.2,Bahasa,4 kerat,21
"Kelat tersisa bercakap selesa
Papaya kasturi gerami pun sama
Mencatat kosa mendakap Bahasa
Supaya Lestari di bumi merata
",Isiah Majid,Himpunan Pantun Warna 94.2,Bahasa,4 kerat,21
"Terap keria tataplah selesa
Galau rasa terlupa segi
Tegap budaya tegaplah Bahasa
Kalau tak kita siapa lagi

",Isiah Majid,Himpunan Pantun Warna 94.2,,,21
"
Kata nista diluahkan jangan
jiwa raga tak terpalit arang;
bukan harta menjadi sanjungan
budi selalu dikenang orang.",Yazid Hussein,Himpunan Pantun Warna 94.2,Budi,4 Baris,24
"
Menangkap bawal bersama duri
semakin lemas baru berhenti;
tiada dijual harga diri
walaupun emas ditawar ganti.
",Yazid Hussein,Himpunan Pantun Warna 94.2,Budi,$ Baris,24
"Sungguh bersakti si pari-pari
bunuh gergasi depan bupati;
budi pekerti hiasan diri
menjadi paksi sehingga mati.",Yazid Hussein,Himpunan Pantun Warna 94.2,Budi,4 Baris,25
"Sama-samalah berguru ajar,
Giat menulis alam dewata;
Sama-samalah kita belajar,
Tekun menulis untuk jelata.",Awang Abdul Muizz bin Awang Marusin,Himpunan Sepanggar Berpantun,,,25
"Mari ke pagar memetik zaitun,
Makan terasi di pekan Gurun;
Mari Sepanggar kita berpantun,
Hidup tradisi turun-temurun.",Awang Abdul Muizz bin Awang Marusin,Himpunan Sepanggar Berpantun,,,25
"Idea kreatif penemuan baru
Malaysia madani jadi pemaju
Muda berinovatif ciptaan baru
Teknologi kini negara maju",NUR SHAHEEN IZAZI,Himpunan Sepanggar Berpantun,,,25
"Bersikap jitu hendaklah diterap,
Kekal abadi keutuhan diri,
Keyakinan itu perlu diperap,
 Kelak menjadi kebiasaan diri",Eva Alexandra D Egbert,Himpunan Sepanggar Berpantun,,,25
"Si pahlawan seni yakin berkata
Petah berbicara sangat berkuasa
Malaysia madani slogan dicipta
Agar negara maju sentiasa",Faris Syazwan ,Himpunan Sepanggar Berpantun,,,25
"Cerita hikayat menjadi kisah,
Jadi tradisi untuk teladani,
Kreativiti rakyat perlu diasah,
Agar inovasi rakyat madani.",Eva Alexandra D Egbert,Himpunan Sepanggar Berpantun,,,25
"Bunga matahari bunga lara,
Indah tanam tepi akasia
Negara maju aman negara
Rakyat muafakat hidup sentosa
",,Himpunan Sepanggar Berpantun,,,13
"melati kutum tumbuh merata
sayang perbah di pohon cemara ,
assalamualaikum pembuka kata,
saya sembah pembuka bicara",,Himpunan Sepanggar Berpantun,,,22
"Saling bermuara putera Melaka,
Sesudahlah diri hidup bersara;
Satu suara laungkan merdeka,
Tegarkan diri untukmu negara.",NURHIDAYAH BINTI AZLI,Himpunan Sepanggar Berpantun,,,25
"Berdatang bertegak bermati matian
setia berkorban demi negara
berdirilah tegak penuh kepastian
setia berkorban walau sengsara",EVA ALEXANDRA D EGBERT,Himpunan Sepanggar Berpantun,,,25
"Merasa leka si budiman Atan,
Seorang petani telah bersara;
Laungan merdeka jadi sahutan,
Teguh madani harapan negara.",CHELSEA SELVIE CHARLES,Himpunan Sepanggar Berpantun,,,25
"Pelbagai budaya, pelbagai bangsa,
hidup berbakti tidak sia-sia;
jadi pembudaya budi bahasa,
hormat-hormati amalan mulia.",SHAZWANA SHAMSUDIN,Himpunan Sepanggar Berpantun,,,25
"Daun yang diikat daun selasih,
Bawa berbesan menjadi senyuman,
Saling mengikat jalinan berkasih,
Menyebar ihsan mengukir pedoman.",IZWAN LO,Himpunan Sepanggar Berpantun,,,25
"Bunga di ribaan bunga raya,
Pahlawan mati, nama disanjung,
Kesejahteraan jadi budaya,
hormat-hormati selalu dijunjung.",SHARIFAH SYAHIRA,Himpunan Sepanggar Berpantun,,,25
"Mat Salleh beradu gah perkasa,
Berjuang dalam Bumiputera;
Bersatu padu tak kira bangsa,
Hidup dalam aman sejahtera.",NURHIDAYAH BINTI AZLI,Himpunan Sepanggar Berpantun,,,25
"Ikan tenggiri dalam kuali,
Goreng gelama jugalah parang;
Biru denggri lasak sekali,
tahan lama dikata orang.",CG Karmin Abbas ,Himpunan Pantun CG Karmin ,Pakaian,Gurauan,25
"Selempang batik lagi bersanggul,
busana merah di singgahsana;
Mempelai cantik tampilan unggul,
makin cerah seri suasana.",CG Karmin Abbas ,Himpunan Pantun CG Karmin ,Pengantin,Pujian,25
"Setiap bernyawa pasti mati,
inap sejenak alam dunia;
Hidup hendaklah berpuas hati,
syukur segala nikmat dikurnia.",Abdul Malek,Himpunan Pantun Warna 94.2,Nasihat,Nasihat,21
"Seloka jauhari sungguh lembut,
dilantun-lantun sambil ditular;
Setiap hari disebut-sebut,
RAI Pantun menjadi popular.",CG Karmin Abbas,Himpunan Pantun Warna 94.2,RAI Pantun,Pujian,25
"Menang seri ataupun kalah,
itu keputusan tiap peraduan;
Pengunaan AI semakinlah menyerlah,
langgan dengan ikut panduan.",Abdul Malek,Himpunan Pantun Warna 94.2,Tema AI,,23
"Mekar di taman Si Bunga Raya,
cantik dipandang setiap orang;
Apa diharap kepada saya,
harta tiada budi pun kurang.",Abdul Malek,Himpunan Pantun Warna 94.2,Santai,Santai,23
"Sudah bersarang sepasang tempua,
sarangnya tinggi tidaklah rendah;
Dulu seorang sekarang berdua,
ikatan janji tertunailah sudah.",A B Shaik,Himpunan Pantun Warna 94.2,pengantin,hiburan,24
"Kalau tuan hamba pergi ke Kenya
Singgahlah sebentar di kedai roti
Ibadah hamba hanya kepada-Nya
Hidup sebentar selalu berkati",Muchzani bin Baharuddin,Himpunan Sepanggar Berpantun,,,25
"Anaklah beruk di pekan Chukai
Pandai berhidup di tepi kendi
Biarlah buruk kain dipakai
Asalkan hidup pandai berbudi",Mohamad Hamyzan Bin Adam ,Himpunan Sepanggar Berpantun,,,25
"Pergi ke sungai menangkap ikan
Petik rambutan mengguna galah
Hidup mencabar kita harungkan
Janganlah tuan mudah mengalah",Adain Bin Dzulkifli,Himpunan Sepanggar Berpantun,,,23
"Berjalan ke kota pergi memburu
Membekallah pukat membawa jerat
Hendaklah kita menghormati guru
Ilmukan berkat dunia akhirat",Afiemi izwan Bin mohammad,Himpunan Sepanggar Berpantun,,,25
"Negara kaya, negara miskin
Bulat jaya janji bersejarah
Segera jaya semangat yakin
Belum jaya, janganlah menyerah",Sittinor azrah binti josli,Himpunan Sepanggar Berpantun,,,25
"Wangi bunga di lereng Daik
Hinggap cantik rerama rasa
Saling hormat sikap terbaik
Tidak kira agama, bangsa",Nurul afiqah binti talip,Himpunan Sepanggar Berpantun,,,23
"Bunga melati bunga dikarang
Kumbang mencari ke mana saya
Hancurlah hati hamba sekarang
Dibenci diri apakan daya",Norhidayah binti ramlan,Himpunan Sepanggar Berpantun,,,25
"Sungguh tinggi si layang-layang,
jatuh hala ke atas kain;
Jika di hati terasa sayang,
kenapa pula cari yang lain?",Roslina,Himpunan Pantun Warna 94.2,Sayang,Pertanyaan,25
"Indah atma warna pelangi
Berlama-lama bernostalgia
Ke lurah sama diharungi
Usaha sama bawa bahgia",Cahaya nurbayu binti mazri,Himpunan Sepanggar Berpantun,,,25
"Sungainya bersih ramai yang cinta
Langitnya mara bumi berputar
Indah dan bersih amalan kita
Terpelihara alam sekitar",Abdul rahim bin merah,Himpunan Sepanggar Berpantun,,,25
"Pergi ke kota jalan sendiri
Di musim luruh membeli benih
Haruslah kita baiki diri
Buang yang keruh, ambil yang jernih",Mohammad Fazli bin Abd Kifle,Himpunan Sepanggar Berpantun,,,25
"Kalau berkedup seruling ratu
Siapa ikut takkan terlerai
Kalaulah hidup saling membantu
Kusut tak ikut, nanti terlerai",Mohammad Azrie Bin Binor,Himpunan Sepanggar Berpantun,,,25
"Suhu rendah di Bukit Petiti
Buahlah epal merah teraan
Pelbagai kaum kita hormati
Demi jaga kesejahteraan",Aiman Syahmie Bin Amatsalleh,Himpunan Sepanggar Berpantun,,,23
"Pergi ke sekolah berbaju biru
Pulang sekolah lewat pukul satu
Murid selalulah hormati guru
Guru ajarkanlah ilmu bermutu",Amni Bin Mohd Yuzwan,Himpunan Sepanggar Berpantun,,,25
"Berlari ke litar si kucing parsi
Berlari-lari ke pohon lestari
Alam sekitar jagai, hiasi
Supayalah hari indah berseri",Akmal aqra bin ramlan,Himpunan Sepanggar Berpantun,,,25
"Hendak berumah di seberang sana,
Membawa barang dari kota,
Nasihat orang tua sangatlah berguna,
Kerana mereka lebih makan garam dari kita.",Roslina,Himpunan Pantun Warna 94.2,nasihat,4 kerat,15
"Kan ku semat segala kata,
Ku simpan dalam jiwa dan raga,
Ikatan dibina menghalalkan kita,
Semoga  berbahagia hingga ke pintu syurga",Roslina,Himpunan Pantun Warna 94.2,doa,4 kerat,17
"Sinaran cahaya di atas awan
Harapan didoa, capai menara
Usaha, percaya, pantang dilawan
Sukses didoa, gapai sejahtera",Muhammad luqman,Himpunan Sepanggar Berpantun,,,25
"Awanlah redup kampung Indani
Rumahnya teguh di tanah tinggi
Langkahlah hidup kita jalani
Yakin yang teguh dijunjung tinggi",Muhammad ezzarul bin roslan ,Himpunan Sepanggar Berpantun,,,25
"Daun beluntas dan biji-bijian
Dimakanlah Midah bersama santan
Engkaulah pantas mendapat pujian
Kerana sudah menjadi panutan",Mohamad Nazwin Bin kiwai,Himpunan Sepanggar Berpantun,,,25
"Harumlah sungguh bunga melati
Hiasan sanggul amat memikat
Bertolak ansur dan menghormati
Kukuh perpaduan, tanda muafakat",Muhammad Zul Hilmi Bin Matalih,Himpunan Sepanggar Berpantun,,,23
"Sarapan bersama teh dan roti
Alor Setar, Kedah bersama Ranggi
Berbuat baik dan menghormati
Pastinya mudah, tiadalah rugi",Hairul nizwan,Himpunan Sepanggar Berpantun,,,22
"Sudah bersarang burung tempua,
sarangnya tinggi tidaklah rendah;
Dahulu seorang sekarang berdua,
ikatan janji tertunai sudah.",abshaik,Himpunan Pantun Warna 94.2,pengantin,hiburan,22
"Anaklah beruk duduk sendiri,
teman si pandai di tepi titi;
Biarlah buruk rupa sendiri,
asalkan pandai mengambil hati.",Mohd samzy putera,Himpunan Sepanggar Berpantun,,,25
"Buah dan dedak dari Kendari
Di sisi dadu, di dalam peti
Manakan hendak dibawa diri
Hatiku rindu setengah mati",ASYRUL AFID,Himpunan Sepanggar Berpantun,,,25
"Bapa si Ita pergi ke Labu
Awannya redup di laman makmur
Janganlah kita memakan syabu
Supaya hidup aman dan makmur",IQHMAL HAKIM BIN LUKMAN,Himpunan Sepanggar Berpantun,,,25
"Makan Ayah bersama pak Abu
Di bawah redup Pulau Sentosa
Hormati ayah, sayangi ibu
Agarlah hidup aman sentosa",Maidin Bin Nasrol,Himpunan Sepanggar Berpantun,,,25
"Anak pak Heru pergi ke kota
Membawa besi, berlari laju
Benda yang baru perlu dicipta
Agar inovasi tambah maju",Jumat Bin Abdul Kayat,Himpunan Sepanggar Berpantun,,,25
"Baik kita dipandanglah mulia
Jahat budi dipandanglah binasa
Marilah kita berakhlak mulia
Orang berbudi kita berbahasa",Mohmmad Aiedyl Aieyman,Himpunan Sepanggar Berpantun,,,25
"Hebat bertempur di medan tamu
tangkas laksamana menangkis panglima
pelajar digempur budayakan ilmu
pemangkin wacana segandingkah sama",NUR SYAMIMI BINTI SANNY,Penggemar Pantun,pendidikan abad ke-21,pantun moden,24
"bumi redup dibawah awan,
terlindung teruna dari mentari,
pentingnya hidup adanya kawan,
kawan bagaimana harus dicari",NUR SYAHIRAH BINTI MOHD SYUKRI,Penggemar Pantun,nasihat,pantun nasihat,23
"kebaya merah dipakai nyonya
berjalan terus sopannya cara
warisan sejarah tinggi nilainya
dipertahan arus bagaimana cara",Sophia Al Khushairi binti Abdul Qayyum,Penggemar Pantun,warisan sejarah,pantun tradisi,24
"Kendara Hidayat pergi Sandakan
Di Suarasa jumpalah sahabat
Pemimpinlah rakyat dipertahankan
Bawa sentosa, terelak musibat",Muhammad afiq bin sakka,Himpunan Sepanggar Berpantun,,,25
"Bungalah raya bunga kebangsaan
Warnanya merah sangatlah menawan
Ogos bulan raya kemerdekaan
Merdeka jazirah, dirai kawan",Muhd emilshahril ikhwan bim kamrin,Himpunan Sepanggar Berpantun,,,25
"Pisang si Mamat dihinggap rerama
Dimakanlah satu si kera kaya
Salinglah hormat antara agama
Rakyat bersatu, negara berjaya",Mohd Ikhmal Bin Ali Adam,Himpunan Sepanggar Berpantun,,,25
"Burung merpati hinggap di sarang
Berinci-inci terbang beraya
Hancurlah hati hamba sekarang
Orang membenci apakan daya",Abdullah muhamad bin habidin,Himpunan Sepanggar Berpantun,,,25
"Dulukan salam guru dan tamu
Agar berjaya kemudian hari
Siang dan malam tanpalah jemu
Akhlak berjaya hiasan diri",Mohammad Shukrey Bin Abdullah,Himpunan Sepanggar Berpantun,,,25
"Perahu raja di pantai Losong
Tiaplah senja bertepung puri
Malu bekerja, perutlah kosong
Mata senja menjadi pencuri",Muhammad irfan irhan bin alwi,Himpunan Sepanggar Berpantun,,,25
"Main sengat pantang dipegang
Main senduk pantang berlaga
Main semangat juang gelanggang
Main menanduk, raih tenaga",MUHAMAD ZAIFULNIZAM BIN ZAIDEE,Himpunan Sepanggar Berpantun,,,25
"Bungalah ini menumbuh di laman
Di teratak kadi mekar tumbuhnya
Dunia ini hanyalah pinjaman
Akhirat menjadi destinasinya",Sharidzuan Fitree Bin Sain,Himpunan Sepanggar Berpantun,,,25
"Keranalah cinta kuhantar tanda
Kusemat di hati si mawar putih
Keranalah harta jiwa ternoda
Angkara hati buana merintih",Muahammad syukri bin aljen,Himpunan Sepanggar Berpantun,,,25
"Pergi ke litar berjaga-jaga
Dipetik hidup bunga berseri
Alam sekitar perlu dijaga
Agarlah hidup indah berseri",Muhamad airul aimin bin azrun,Himpunan Sepanggar Berpantun,,,25
"Air di sampan masuklah telaga
Murahnya buah tidaklah terkata
Adab dan sopan haruslah dijaga
Aman maruah keluarga kita",Mohamad yus akmal firza bin muslimat ,Himpunan Sepanggar Berpantun,,,25
"Petik melati tepi jeriji
Buat Amira masa puasa
Saling hormati sikap terpuji
Tidak kira agama dan bangsa",Farrel athariz lee abdullah,Himpunan Sepanggar Berpantun,,,25
"Ke pantai kita di pukul lapan
Sesudah redup singgah labuhan
Hidupnya kita haruslah sopan
Supaya hidup dirahmat Tuhan",MOHAMMAD SABRI BIN MOHD SAID,Himpunan Sepanggar Berpantun,,,25
"Letak kitab di atas karang
Dibaca Kiram sambil cuba
Dalam kitab, ada terlarang
Amal haram jangan dicuba",Mohd Nazri Bin Matawa,Himpunan Sepanggar Berpantun,,,25
"Kalaulah hendak menjerat rusa
Siapkan kati tersimpul kuat
Kalaulah hendak berbuat jasa
Tetapkan hati, betulkan niat",Muhammad harulnihzal bin ridzuan,Himpunan Sepanggar Berpantun,,,25
"Pisau belati di bawah dahan
Keli dibelah di rimbun pohon
Hidup dan mati di tangan Tuhan
Kepada Allah kita memohon",Mohammad Rahmat Bin Ridduan,Himpunan Sepanggar Berpantun,,,25
"Pucuk kemiri di tanah adat
Banyaklah sudah jatuh ke tanah
Buruk negeri lupakan adat
Akhlaklah rendah runtuhlah ranah",Aizm bin benjamin,Himpunan Sepanggar Berpantun,,,25
"Dibilang kata disebut adat,
Adat Melayu bersendi syarak,
Kerja disungguh hemat dan adat,
Indahnya budi disulam syarak.",MOHD ISKANDAR IQHWAN BIN JULAIMIN,Himpunan Sepanggar Berpantun,,,23
"Dagang menuntun toko Cilacap
Kilau memancar di kotak peci
Sopan dan santun kata diucap
Adab dipancar hati nan suci",MUHAMMAD SAHRULNIZAM BIN ABDUL RAHMAN,Himpunan Sepanggar Berpantun,,,25
"Di Tanah Merah bertemu mantan
Mantan menanti coklatlah Belgia
Jangan menyerah di kesulitan
Percaya nanti akan bahagia",Zamarul hisyam bin abtal,Himpunan Sepanggar Berpantun,,,25
"Jangan menggali tanah seberang
Cari dahulu buah kemiri
Jangan mencari salahlah orang
Cari dahulu salah sendiri",Mohd iqmal mary abdullah ,Himpunan Sepanggar Berpantun,,,24
"Pohon meranti subur di taman,
Tempat melihat burung tekukur;
Tabahkan hati tetapkan iman,
Agar sehat dipanjangkan umur.",Hasyuda Abadi ,Himpunan Sepanggar Berpantun,Gembira,Ucapan Hari Jadi,23
"Warnanya kapal merah putih,
gada-gada penentu arah;
Ilmu setimpal jiwa terlatih,
itu petanda orang pemurah.",CG Karmin Abbas ,Himpunan Pantun CG Karmin ,Negara,Ucapan,25
"Lapis-lapiskan kukur kiantan,
tumis gegambir dicatu-catu;
Tapis parutan dapatlah santan,
tapis kaliber dapatlah mutu.",CG Karmin Abbas ,Himpunan Pantun CG Karmin Abbas,Pemimpin ,Sokongan ,23
"Kalau sepiak tak terpemanai,
bayang-bayangkan sepanjang masa;
Fitnah membiak bak anai-anai,
perlahan-lahan memakan mangsa.",CG Karmin Abbas ,Himpunan Pantun CG Karmin Abbas,Pemimpin ,Sokongan ,24
"Jikalau duduk di atas ambin,
tangan menyilih alif ke ba;
Jikalau duduk dengan pemimpin,
jangan menindih riba ke riba.",CG Karmin Abbas ,Himpunan Pantun CG Karmin Abbas,Pemimpin ,Sokongan ,21
"Walau setahil emas suasa,
tuang ke rawa menjadi lambang;
Walaupun kerdil jelas dirasa,
tuang ke jiwa menjadi kembang.",CG Karmin Abbas ,Himpunan Pantun CG Karmin Abbas,Pemimpin ,Sokongan ,24
"Beriring balam dengan merbah,
buah lakum dijolok jatuh;
Berkirim salam dengann sembah,
Assalamualaikum warrahmatullahi wabarakatuh.",Prof Umar Zein,,Salam,Adab ,25
"Berjalan-jalan ke Brastagi,
jangan lupa jeruk segelas;
Jikalau taulan nak berbagi,
janganlah lupa dengan ikhlas.",Umar Zein,Klinik Pantun Nusantara,Budi Pekerti,Wisata,25
"Pagi redup memanjat cermat,
hendak bungkus buah papaya;
Kalau hidup ada matlamat,
makin fokus makin berjaya.
",CG Karmin Abbas,Himpunan Pantun CG Karmin Abbas,Matlamat,Motivasi,25
"Janji Pak Uda menempa gangsa,
Ditunjuk ajar ayah sang raja;
Jadi pemuda harapan bangsa,
Rajin belajar, giat bekerja.
",Awang Abdul Muizz bin Awang Marusin ,Himpunan Sepanggar Berpantun,Nasihat,,25
"Dagang pendatang bawa kuini,
Burung di lantai hinggap dan makan;
Selamat datang, kami di sini;
Dewan Teratai kami aturkan.",Awang Abdul Muizz bin Awang Marusin ,Himpunan Sepanggar Berpantun,Selamat datang,,25
"Cantiknya baju bijak bestari,
Dibawa jalan makan ambuyat;
Salam maju saudara saudari,
Semoga jalan arah hidayat.",Awang Abdul Muizz bin Awang Marusin ,Himpunan Sepanggar Berpantun,Ucap selamat,,25
"Jika parang diasah tajam, 
belum tentu dapat menikam;
Jikalau terang terlajak hadam,
tajamnya jitu terus ditikam.

",Omar ,Penggemar Pantun,Bijak,Nasihat,24
"Jika parang diasah tajam, 
Belum tentu tentu dapat menikam,
Jika kekata terlajak hadam,
Tajamnya parang terus ditikam

",,Penggemar Pantun,,,20
